{
  "timestamp": "2026-08-26T20:42:09.550Z",
  "total_audited": 370,
  "passed_count": 19,
  "failed_count": 351,
  "duration_ms": 93353.73,
  "results": [
    {
      "card_id": "DSA-ADV-CONCURRENT-000",
      "file_path": "decks/01-dsa/advanced-dsa-string-math/concurrent-data-structures/DSA-ADV-CONCURRENT-000.md",
      "url": "https://upload.wikimedia.org/wikipedia/commons/5/52/Data_Queue.svg",
      "http_status": 200,
      "latency_ms": 347.84,
      "passed": true,
      "content_type": "image/svg+xml"
    },
    {
      "card_id": "DSA-ADV-CONCURRENT-001",
      "file_path": "decks/01-dsa/advanced-dsa-string-math/concurrent-data-structures/DSA-ADV-CONCURRENT-001.md",
      "url": "https://upload.wikimedia.org/wikipedia/commons/5/52/Data_Queue.svg",
      "http_status": 200,
      "latency_ms": 251.47,
      "passed": true,
      "content_type": "image/svg+xml"
    },
    {
      "card_id": "DSA-ADV-CONCURRENT-002",
      "file_path": "decks/01-dsa/advanced-dsa-string-math/concurrent-data-structures/DSA-ADV-CONCURRENT-002.md",
      "url": "https://upload.wikimedia.org/wikipedia/commons/5/52/Data_Queue.svg",
      "http_status": 200,
      "latency_ms": 253.23,
      "passed": true,
      "content_type": "image/svg+xml"
    },
    {
      "card_id": "DSA-ADV-CONCURRENT-003",
      "file_path": "decks/01-dsa/advanced-dsa-string-math/concurrent-data-structures/DSA-ADV-CONCURRENT-003.md",
      "url": "https://upload.wikimedia.org/wikipedia/commons/5/52/Data_Queue.svg",
      "http_status": 200,
      "latency_ms": 234.46,
      "passed": true,
      "content_type": "image/svg+xml"
    },
    {
      "card_id": "DSA-ADV-CONCURRENT-004",
      "file_path": "decks/01-dsa/advanced-dsa-string-math/concurrent-data-structures/DSA-ADV-CONCURRENT-004.md",
      "url": "https://upload.wikimedia.org/wikipedia/commons/5/52/Data_Queue.svg",
      "http_status": 200,
      "latency_ms": 238.81,
      "passed": true,
      "content_type": "image/svg+xml"
    },
    {
      "card_id": "DSA-ADV-CONCURRENT-005",
      "file_path": "decks/01-dsa/advanced-dsa-string-math/concurrent-data-structures/DSA-ADV-CONCURRENT-005.md",
      "url": "https://upload.wikimedia.org/wikipedia/commons/5/52/Data_Queue.svg",
      "http_status": 429,
      "latency_ms": 27.39,
      "passed": false,
      "content_type": "text/html; charset=utf-8",
      "error_message": "HTTP 429: Too many requests (76af2b0)"
    },
    {
      "card_id": "DSA-ADV-GAMETHEORY-000",
      "file_path": "decks/01-dsa/advanced-dsa-string-math/game-theory-math/DSA-ADV-GAMETHEORY-000.md",
      "url": "https://upload.wikimedia.org/wikipedia/commons/0/0c/Vector_reserve.svg",
      "http_status": 429,
      "latency_ms": 28.67,
      "passed": false,
      "content_type": "text/html; charset=utf-8",
      "error_message": "HTTP 429: Too many requests (76af2b0)"
    },
    {
      "card_id": "DSA-ADV-GAMETHEORY-001",
      "file_path": "decks/01-dsa/advanced-dsa-string-math/game-theory-math/DSA-ADV-GAMETHEORY-001.md",
      "url": "https://upload.wikimedia.org/wikipedia/commons/0/0c/Vector_reserve.svg",
      "http_status": 404,
      "latency_ms": 251.69,
      "passed": false,
      "content_type": "text/html; charset=UTF-8",
      "error_message": "HTTP 404: Not Found"
    },
    {
      "card_id": "DSA-ADV-GAMETHEORY-002",
      "file_path": "decks/01-dsa/advanced-dsa-string-math/game-theory-math/DSA-ADV-GAMETHEORY-002.md",
      "url": "https://upload.wikimedia.org/wikipedia/commons/0/0c/Vector_reserve.svg",
      "http_status": 429,
      "latency_ms": 44.17,
      "passed": false,
      "content_type": "text/html; charset=utf-8",
      "error_message": "HTTP 429: Too many requests (76af2b0)"
    },
    {
      "card_id": "DSA-ADV-GAMETHEORY-003",
      "file_path": "decks/01-dsa/advanced-dsa-string-math/game-theory-math/DSA-ADV-GAMETHEORY-003.md",
      "url": "https://upload.wikimedia.org/wikipedia/commons/0/0c/Vector_reserve.svg",
      "http_status": 429,
      "latency_ms": 38.39,
      "passed": false,
      "content_type": "text/html; charset=utf-8",
      "error_message": "HTTP 429: Too many requests (76af2b0)"
    },
    {
      "card_id": "DSA-ADV-GAMETHEORY-004",
      "file_path": "decks/01-dsa/advanced-dsa-string-math/game-theory-math/DSA-ADV-GAMETHEORY-004.md",
      "url": "https://upload.wikimedia.org/wikipedia/commons/0/0c/Vector_reserve.svg",
      "http_status": 429,
      "latency_ms": 34.5,
      "passed": false,
      "content_type": "text/html; charset=utf-8",
      "error_message": "HTTP 429: Too many requests (76af2b0)"
    },
    {
      "card_id": "DSA-ADV-GAMETHEORY-005",
      "file_path": "decks/01-dsa/advanced-dsa-string-math/game-theory-math/DSA-ADV-GAMETHEORY-005.md",
      "url": "https://upload.wikimedia.org/wikipedia/commons/0/0c/Vector_reserve.svg",
      "http_status": 429,
      "latency_ms": 43.85,
      "passed": false,
      "content_type": "text/html; charset=utf-8",
      "error_message": "HTTP 429: Too many requests (76af2b0)"
    },
    {
      "card_id": "DSA-ADV-STRING-000",
      "file_path": "decks/01-dsa/advanced-dsa-string-math/string-matching/DSA-ADV-STRING-000.md",
      "url": "https://upload.wikimedia.org/wikipedia/commons/0/0c/Vector_reserve.svg",
      "http_status": 429,
      "latency_ms": 32.68,
      "passed": false,
      "content_type": "text/html; charset=utf-8",
      "error_message": "HTTP 429: Too many requests (76af2b0)"
    },
    {
      "card_id": "DSA-ADV-STRING-001",
      "file_path": "decks/01-dsa/advanced-dsa-string-math/string-matching/DSA-ADV-STRING-001.md",
      "url": "https://upload.wikimedia.org/wikipedia/commons/0/0c/Vector_reserve.svg",
      "http_status": 429,
      "latency_ms": 44.61,
      "passed": false,
      "content_type": "text/html; charset=utf-8",
      "error_message": "HTTP 429: Too many requests (76af2b0)"
    },
    {
      "card_id": "DSA-ADV-STRING-002",
      "file_path": "decks/01-dsa/advanced-dsa-string-math/string-matching/DSA-ADV-STRING-002.md",
      "url": "https://upload.wikimedia.org/wikipedia/commons/0/0c/Vector_reserve.svg",
      "http_status": 404,
      "latency_ms": 27.08,
      "passed": false,
      "content_type": "text/html; charset=UTF-8",
      "error_message": "HTTP 404: Not Found"
    },
    {
      "card_id": "DSA-ADV-STRING-003",
      "file_path": "decks/01-dsa/advanced-dsa-string-math/string-matching/DSA-ADV-STRING-003.md",
      "url": "https://upload.wikimedia.org/wikipedia/commons/0/0c/Vector_reserve.svg",
      "http_status": 429,
      "latency_ms": 27.37,
      "passed": false,
      "content_type": "text/html; charset=utf-8",
      "error_message": "HTTP 429: Too many requests (76af2b0)"
    },
    {
      "card_id": "DSA-ADV-STRING-004",
      "file_path": "decks/01-dsa/advanced-dsa-string-math/string-matching/DSA-ADV-STRING-004.md",
      "url": "https://upload.wikimedia.org/wikipedia/commons/0/0c/Vector_reserve.svg",
      "http_status": 429,
      "latency_ms": 37.58,
      "passed": false,
      "content_type": "text/html; charset=utf-8",
      "error_message": "HTTP 429: Too many requests (76af2b0)"
    },
    {
      "card_id": "DSA-ADV-STRING-005",
      "file_path": "decks/01-dsa/advanced-dsa-string-math/string-matching/DSA-ADV-STRING-005.md",
      "url": "https://upload.wikimedia.org/wikipedia/commons/0/0c/Vector_reserve.svg",
      "http_status": 429,
      "latency_ms": 34.4,
      "passed": false,
      "content_type": "text/html; charset=utf-8",
      "error_message": "HTTP 429: Too many requests (76af2b0)"
    },
    {
      "card_id": "DSA-ADV-SWEEPLINE-000",
      "file_path": "decks/01-dsa/advanced-dsa-string-math/sweepline-geometry/DSA-ADV-SWEEPLINE-000.md",
      "url": "https://upload.wikimedia.org/wikipedia/commons/0/0c/Vector_reserve.svg",
      "http_status": 429,
      "latency_ms": 38.57,
      "passed": false,
      "content_type": "text/html; charset=utf-8",
      "error_message": "HTTP 429: Too many requests (76af2b0)"
    },
    {
      "card_id": "DSA-ADV-SWEEPLINE-001",
      "file_path": "decks/01-dsa/advanced-dsa-string-math/sweepline-geometry/DSA-ADV-SWEEPLINE-001.md",
      "url": "https://upload.wikimedia.org/wikipedia/commons/0/0c/Vector_reserve.svg",
      "http_status": 429,
      "latency_ms": 29.49,
      "passed": false,
      "content_type": "text/html; charset=utf-8",
      "error_message": "HTTP 429: Too many requests (76af2b0)"
    },
    {
      "card_id": "DSA-ADV-SWEEPLINE-002",
      "file_path": "decks/01-dsa/advanced-dsa-string-math/sweepline-geometry/DSA-ADV-SWEEPLINE-002.md",
      "url": "https://upload.wikimedia.org/wikipedia/commons/0/0c/Vector_reserve.svg",
      "http_status": 429,
      "latency_ms": 37.16,
      "passed": false,
      "content_type": "text/html; charset=utf-8",
      "error_message": "HTTP 429: Too many requests (76af2b0)"
    },
    {
      "card_id": "DSA-ADV-SWEEPLINE-003",
      "file_path": "decks/01-dsa/advanced-dsa-string-math/sweepline-geometry/DSA-ADV-SWEEPLINE-003.md",
      "url": "https://upload.wikimedia.org/wikipedia/commons/0/0c/Vector_reserve.svg",
      "http_status": 429,
      "latency_ms": 30.36,
      "passed": false,
      "content_type": "text/html; charset=utf-8",
      "error_message": "HTTP 429: Too many requests (76af2b0)"
    },
    {
      "card_id": "DSA-ADV-SWEEPLINE-004",
      "file_path": "decks/01-dsa/advanced-dsa-string-math/sweepline-geometry/DSA-ADV-SWEEPLINE-004.md",
      "url": "https://upload.wikimedia.org/wikipedia/commons/0/0c/Vector_reserve.svg",
      "http_status": 429,
      "latency_ms": 27.29,
      "passed": false,
      "content_type": "text/html; charset=utf-8",
      "error_message": "HTTP 429: Too many requests (76af2b0)"
    },
    {
      "card_id": "DSA-ADV-SWEEPLINE-005",
      "file_path": "decks/01-dsa/advanced-dsa-string-math/sweepline-geometry/DSA-ADV-SWEEPLINE-005.md",
      "url": "https://upload.wikimedia.org/wikipedia/commons/0/0c/Vector_reserve.svg",
      "http_status": 404,